Site,Region,Date_Seeded,Date_Monitored,Plot,Treatment,PlotMix,CodeOriginal,Seeded_Cover,Total_Veg_Cover,raw.row,source,MonitorID
SRER,Sonoran SE,2019-08-09T00:00:00Z,2021-03-11T00:00:00Z,31,Mulch,Warm,1 full BOCU (3) in the northwest corner. A couple potentially smaller grazed down ones throughout as well as a couple potential ARPUs (2),1,3,4707,add1,4716
SRER,Sonoran SE,2019-08-09T00:00:00Z,2021-03-11T00:00:00Z,24,Seed,Medium,1 Possible PLJA (1 out of 3 on certainty) on south border as well as some BOCUs (might be BOER but probably BOCU or other BOsp.) Mostly grazed,TR,3,4700,add1,4709
Patagonia,Sonoran SE,2019-08-09T00:00:00Z,2021-03-12T00:00:00Z,4,Mulch,Warm,3 individual ARPUs  and a BOCU,2,3,4716,add1,4725
SRER,Sonoran SE,2019-08-09T00:00:00Z,2021-03-11T00:00:00Z,23,Pits,Warm,A couple BOCUs and a couple potential BOCU nubs and a possible ARPU,1,4,4699,add1,4708
SRER,Sonoran SE,2019-08-09T00:00:00Z,2021-10-08T00:00:00Z,20,ConMod,Warm,"A couple small SECOs mostly near conmods and possiblya young POSE near SE conmod, Also decent size patch (~1% cover) of SECO just near/outside N edge",1,99,4768,add1,4777
Patagonia,Sonoran SE,2019-08-09T00:00:00Z,2021-03-12T00:00:00Z,3,Pits,Warm,A few ARPUs and young BOCUs mostly near/in the south half except for a smaller ARPU in the northwest and a BAMU just north of subplot,4,8,4715,add1,4724
Patagonia,Sonoran SE,2019-08-09T00:00:00Z,2021-03-12T00:00:00Z,15,Mulch,Warm,ARPU about 5 individuals and an individual BAMU resprouting at base,2,6,4727,add1,4736
Patagonia,Sonoran SE,2019-08-09T00:00:00Z,2021-03-12T00:00:00Z,32,Pits,Warm,"ARPU many individuals, BAMU 1 individual, PLMU (2) 1 individual, ACHY (2) 1 individual",2,4,4744,add1,4753
SRER,Sonoran SE,2019-08-09T00:00:00Z,2021-10-06T00:00:00Z,2,Seed,Warm,Couple medium sized ARPUs (not completely sure 2/3 on certainty of ID) and a large BOCU right next to the NW plot marker rooted just outside of the plot but some overhangs into the plot,1,96,4750,add1,4759
Patagonia,Sonoran SE,2019-08-09T00:00:00Z,2021-10-13T00:00:00Z,10,Seed,Warm,Couple small to medium ARPUs throughout and a couple small SECOs in N half of the plot typically hidden under/using ERCU as a shade plant,3,75,4794,add1,4803
SRER,Sonoran SE,2019-08-09T00:00:00Z,2021-10-08T00:00:00Z,23,Pits,Warm,Extra large to medium large BOCUs throughout and at least 2 tiny SECO near/in SE pit and NE/subplot pit,10,99,4771,add1,4780
Patagonia,Sonoran SE,2019-08-09T00:00:00Z,2021-03-12T00:00:00Z,2,ConMod,Warm,Large BOCU in the southeast with a few small ones throughout and about 5 ARPUs small to large in size that're mostly near the conmods,3,4,4714,add1,4723
Patagonia,Sonoran SE,2019-08-09T00:00:00Z,2021-10-13T00:00:00Z,16,Pits,Warm,"Medium SECO in/near NW pit with a couple tiny seedlings scattered throughout, medium BAMU in the middle, a few small to medium/large ARPUs sprinkled throughout, possibly a small ACHY in SE section (wirey leaf blades that clasp the stem, hairs at the node, only one seed head but similar to examples)",7,70,4800,add1,4809
SRER,Sonoran SE,2019-08-09T00:00:00Z,2021-10-09T00:00:00Z,25,ConMod,Warm,Medium sized BOCU and ARPU,3,90,4773,add1,4782
Patagonia,Sonoran SE,2019-08-09T00:00:00Z,2021-10-13T00:00:00Z,11,ConMod,Warm,Medium to large ARPUs throughout and a couple small and medium BOCUs near the N conmods and a few teeny tiny SECOs near conmods as well,8,93,4795,add1,4804
Patagonia,Sonoran SE,2019-08-09T00:00:00Z,2021-10-14T00:00:00Z,25,Pits,Warm,"Multiple ARPUs small to large sized throughout, possible ACHY in the SE pit, and a couple teeny tiny SECOs in/around some of the pits",9,70,4809,add1,4818
SRER,Sonoran SE,2019-08-09T00:00:00Z,2021-10-06T00:00:00Z,1,ConMod,Warm,Multiple BOCU's medium-large and a possible medium sized ARPU,4,88,4749,add1,4758
SRER,Sonoran SE,2019-08-09T00:00:00Z,2021-10-09T00:00:00Z,30,Seed,Warm,Multiple med to extra large BOCUs and a few small to large ARPUs,13,80,4778,add1,4787
Patagonia,Sonoran SE,2019-08-09T00:00:00Z,2021-10-14T00:00:00Z,32,Pits,Warm,Multiple medium to extra large ARPUs and large BAMU along the N edge of the plot along with possible tiny seedlings in same pits,10,97,4816,add1,4825
Patagonia,Sonoran SE,2019-08-09T00:00:00Z,2021-10-13T00:00:00Z,1,Seed,Warm,Multiple medium to large ARPU and small/medium BOCU near the NE corner and a couple tiny SECOs,7,60,4785,add1,4794
Patagonia,Sonoran SE,2019-08-09T00:00:00Z,2021-10-13T00:00:00Z,15,Mulch,Warm,Multiple small to large ARPUs throughout along with a large BAMU in center and a medium sized BOCU in the NW section,11,45,4799,add1,4808
Patagonia,Sonoran SE,2019-08-09T00:00:00Z,2021-10-13T00:00:00Z,3,Pits,Warm,Multiple small to medium ARPUs and BOCUs along with a possible PLMU (rough feeling leaves and similar seeds) with a couple small/medium BAMU that are in or near the N half of the pits and a couple small SECO seedlings sprinkled throughout,13,85,4787,add1,4796
Patagonia,Sonoran SE,2019-08-09T00:00:00Z,2021-03-12T00:00:00Z,31,Mulch,Warm,Possible ACHY near southwest corner (2 certainty) and about 10 ARPU small to medium in size with 2 of them next to the subplot but not quite in,2,20,4743,add1,4752
SRER,Sonoran SE,2019-08-09T00:00:00Z,2021-10-06T00:00:00Z,3,Pits,Warm,"Possible ARPUs, SECO seedling in subplot",TR,98,4751,add1,4760
Patagonia,Sonoran SE,2019-08-09T00:00:00Z,2021-10-14T00:00:00Z,31,Mulch,Warm,"Possible couple small ASTUs along with multiple medium to extra large ARPUs, possibly a few BAMU seedlings as well as a couple tiny to small SECOs throughout",15,99,4815,add1,4824
Patagonia,Sonoran SE,2019-08-09T00:00:00Z,2021-10-14T00:00:00Z,21,Seed,Medium,"Possible SPCR in subplot, Blue not Black grama",TR,94,4805,add1,4814
SRER,Sonoran SE,2019-08-09T00:00:00Z,2021-10-07T00:00:00Z,11,Pits,Warm,Possible young BOCU and ARPU but no seed heads yet therfor unsure ifit is than seeded species cover is 1% but if not it's trace amount because of a few SECOs all found in or near pits,TR,95,4759,add1,4768
Patagonia,Sonoran SE,2019-08-09T00:00:00Z,2021-10-14T00:00:00Z,20,Pits,Medium,"Possibly small POSE and SPCR in the S half of the plot, BLUE grama not BLACK",TR,73,4804,add1,4813
SRER,Sonoran SE,2019-08-09T00:00:00Z,2021-10-09T00:00:00Z,31,Mulch,Warm,Quite a few small tp extra large BOCUs throughout along with a possible ASTU,11,82,4779,add1,4788
Patagonia,Sonoran SE,2019-08-09T00:00:00Z,2021-10-13T00:00:00Z,4,Mulch,Warm,Small to large ARPUs and BOCUs along with a couple small SECOs as well as a possible PLMU in the middle (rough feeling and membranous ligule but no seed heads),10,82,4788,add1,4797
Patagonia,Sonoran SE,2019-08-09T00:00:00Z,2021-10-14T00:00:00Z,23,Mulch,Warm,Small to large ARPUs throughout along with a tiny baby SECO seedling in SE section,17,67,4807,add1,4816
Patagonia,Sonoran SE,2019-08-09T00:00:00Z,2021-10-14T00:00:00Z,22,ConMod,Warm,Small to large ARPUs throughout and a couple of small SECOs,15,97,4806,add1,4815
Patagonia,Sonoran SE,2019-08-09T00:00:00Z,2021-10-14T00:00:00Z,30,ConMod,Warm,Small to medium ARPUs throughout and a few tiny to small SECOs mostly near the conmods,11,75,4814,add1,4823
Patagonia,Sonoran SE,2019-08-09T00:00:00Z,2021-10-14T00:00:00Z,19,Seed,Warm,Small to medium ARPUs throughout and small/medium BAMU near the NE edge,5,78,4803,add1,4812
Patagonia,Sonoran SE,2019-08-09T00:00:00Z,2021-10-13T00:00:00Z,2,ConMod,Warm,Small/medium to large ARPUs and small to large BOCU throughout,12,80,4786,add1,4795
SRER,Sonoran SE,2019-08-09T00:00:00Z,2021-03-10T00:00:00Z,10,ConMod,Warm,Some type of Aristida possibly and ARPU and maybe 1 small maybe BOCU near subplot that's been grazed down,TR,6,4686,add1,4695
Patagonia,Sonoran SE,2019-08-09T00:00:00Z,2021-03-12T00:00:00Z,16,Pits,Warm,Southwest pit has 1 BAMU and 4 small ARPUs. Northwest pit has 2 medium and 2 small ARPUs and 1 dreid up SECO. There are a few more small to medium sized ARPUs throughout,2,13,4728,add1,4737
Patagonia,Sonoran SE,2019-08-09T00:00:00Z,2021-10-14T00:00:00Z,33,ConMod,Medium,SW conmod is overgrown with Blue grama but NO black grama but thee's a possible young PEPA by the NW conmod,TR,95,4817,add1,4826
